{
  "$schema": "./schema/benchmark.schema.json",
  "generated": "2026-08-24T00:00:00Z",
  "generator": "scripts/generate-data.mjs",
  "demo": true,
  "note": "DEMO DATA. Synthetic records for development. Replace with CI-generated index from results/.",
  "benchmarkVersion": "1.2.0",
  "records": [
    {
      "id": "RUN-2026-07-11-000157",
      "model": "Llama 3.1 70B",
      "family": "llama",
      "modelRevision": "e379bab58282abcc753a484993f9df0bf022f129",
      "quantization": "Q6_K",
      "hardware": "M2 Ultra",
      "gpuVendor": "APPLE",
      "vram": 192,
      "ram": 192,
      "cpu": "M2 Ultra",
      "engine": "exllamav2",
      "engineVersion": "0.3.6",
      "benchmarkVersion": "1.2.0",
      "promptTokens": 2048,
      "generatedTokens": 1024,
      "promptTPS": 137.8,
      "generationTPS": 10.3,
      "ttft": 14647,
      "score": 32.7,
      "contributor": "vrampilot",
      "timestamp": "2026-07-11T10:45:29Z",
      "gitCommit": "ba4df744c3aa729b869bade34dececdfa1175ac8",
      "status": "VERIFIED"
    },
    {
      "id": "RUN-2026-07-13-000158",
      "model": "Mistral Small 24B",
      "family": "mistral",
      "modelRevision": "e41a539e352085bec46af84d07a80193ffdc5041",
      "quantization": "Q8_0",
      "hardware": "M2 Ultra",
      "gpuVendor": "APPLE",
      "vram": 192,
      "ram": 192,
      "cpu": "M2 Ultra",
      "engine": "exllamav2",
      "engineVersion": "0.3.6",
      "benchmarkVersion": "1.2.0",
      "promptTokens": 4096,
      "generatedTokens": 2048,
      "promptTPS": 263,
      "generationTPS": 22.3,
      "ttft": 15622,
      "score": 23.2,
      "contributor": "sgemma",
      "timestamp": "2026-07-13T16:44:32Z",
      "gitCommit": "aa42fd5200fa317b8c03a58d445c541517e82886",
      "status": "VERIFIED"
    },
    {
      "id": "RUN-2026-07-15-000159",
      "model": "Qwen3 27B",
      "family": "qwen",
      "modelRevision": "19c7931ef1c8d05ac6b493f30e890d6a9ab3cd40",
      "quantization": "Q8_0",
      "hardware": "L40S",
      "gpuVendor": "NVIDIA",
      "vram": 48,
      "ram": 128,
      "cpu": "Xeon Silver 4414Y",
      "engine": "ollama",
      "engineVersion": "0.9.3",
      "benchmarkVersion": "1.2.0",
      "promptTokens": 4096,
      "generatedTokens": 1024,
      "promptTPS": 190.2,
      "generationTPS": 18.9,
      "ttft": 21103,
      "score": 21,
      "contributor": "olliestacks",
      "timestamp": "2026-07-15T11:35:43Z",
      "gitCommit": "fd8851102a8b18774addb4f18405db6f2e802b24",
      "status": "REPRODUCED"
    },
    {
      "id": "RUN-2026-07-16-000160",
      "model": "Qwen3 27B",
      "family": "qwen",
      "modelRevision": "552fba5b0da2e369f110d561e0e533759cb5edb9",
      "quantization": "Q4_K_M",
      "hardware": "RTX A6000",
      "gpuVendor": "NVIDIA",
      "vram": 48,
      "ram": 128,
      "cpu": "Xeon w-2295",
      "engine": "llama.cpp",
      "engineVersion": "b5117",
      "benchmarkVersion": "1.2.0",
      "promptTokens": 4096,
      "generatedTokens": 1024,
      "promptTPS": 363.6,
      "generationTPS": 34.7,
      "ttft": 11036,
      "score": 39,
      "contributor": "mrehn-42",
      "timestamp": "2026-07-16T05:55:39Z",
      "gitCommit": "c7d6ca403cd88edd70d303769cd544f8ccea2254",
      "status": "VERIFIED"
    },
    {
      "id": "RUN-2026-07-18-000161",
      "model": "DeepSeek R1 Distill 32B",
      "family": "deepseek",
      "modelRevision": "d70afdcb5c69dc4af70257cb54628e309febab62",
      "quantization": "FP16",
      "hardware": "M3 Ultra",
      "gpuVendor": "APPLE",
      "vram": 192,
      "ram": 192,
      "cpu": "M3 Ultra",
      "engine": "tensorrt-llm",
      "engineVersion": "0.19.0",
      "benchmarkVersion": "1.2.0",
      "promptTokens": 4096,
      "generatedTokens": 2048,
      "promptTPS": 176,
      "generationTPS": 8.8,
      "ttft": 23976,
      "score": 15.2,
      "contributor": "olliestacks",
      "timestamp": "2026-07-18T22:49:55Z",
      "gitCommit": "5e0c150be83c72029e4896c8628efdec5755a8e3",
      "status": "PENDING"
    },
    {
      "id": "RUN-2026-07-20-000162",
      "model": "Llama 3.1 70B",
      "family": "llama",
      "modelRevision": "422f85c29f106e63e171f8528ddb8cdf15975ef4",
      "quantization": "Q8_0",
      "hardware": "H100 SXM",
      "gpuVendor": "NVIDIA",
      "vram": 80,
      "ram": 512,
      "cpu": "Xeon Platinum 8480+",
      "engine": "ollama",
      "engineVersion": "0.9.3",
      "benchmarkVersion": "1.2.0",
      "promptTokens": 8192,
      "generatedTokens": 2048,
      "promptTPS": 280.3,
      "generationTPS": 25.9,
      "ttft": 29154,
      "score": 76.4,
      "contributor": "nilabhz",
      "timestamp": "2026-07-20T07:10:51Z",
      "gitCommit": "7318422a09c5a396aa08e1b7a6ad6d7f27eb54c3",
      "status": "VERIFIED"
    },
    {
      "id": "RUN-2026-07-21-000163",
      "model": "Gemma 3 12B",
      "family": "gemma",
      "modelRevision": "fe1758bbee8e33e2bd169f80e0cd44af67be593c",
      "quantization": "Q4_K_M",
      "hardware": "L40S",
      "gpuVendor": "NVIDIA",
      "vram": 48,
      "ram": 256,
      "cpu": "Xeon Gold 6430",
      "engine": "ollama",
      "engineVersion": "0.10.1",
      "benchmarkVersion": "1.2.0",
      "promptTokens": 8192,
      "generatedTokens": 2048,
      "promptTPS": 664.4,
      "generationTPS": 81.6,
      "ttft": 12191,
      "score": 37.8,
      "contributor": "vrampilot",
      "timestamp": "2026-07-21T02:49:59Z",
      "gitCommit": "e5ebe545d231adde21cf3eabb0b1c0ee9fae02f8",
      "status": "VERIFIED"
    },
    {
      "id": "RUN-2026-07-23-000164",
      "model": "Qwen3 27B",
      "family": "qwen",
      "modelRevision": "1e13d6ee56af8b30ce0f883bb956f8e7a7c536fc",
      "quantization": "Q8_0",
      "hardware": "RTX 5090",
      "gpuVendor": "NVIDIA",
      "vram": 32,
      "ram": 96,
      "cpu": "Ryzen 9 9950X",
      "engine": "vLLM",
      "engineVersion": "0.8.5",
      "benchmarkVersion": "1.2.0",
      "promptTokens": 8192,
      "generatedTokens": 2048,
      "promptTPS": 686.3,
      "generationTPS": 36.6,
      "ttft": 12121,
      "score": 51.7,
      "contributor": "nilabhz",
      "timestamp": "2026-07-23T03:58:03Z",
      "gitCommit": "1651329f1001125afae187388ac187b67d2a02e9",
      "status": "REPRODUCED"
    },
    {
      "id": "RUN-2026-07-25-000165",
      "model": "Phi 4 14B",
      "family": "phi",
      "modelRevision": "4d40086312982aeec51127461e62d056c6f63e76",
      "quantization": "Q8_0",
      "hardware": "A100 80GB SXM",
      "gpuVendor": "NVIDIA",
      "vram": 80,
      "ram": 512,
      "cpu": "EPYC 7763",
      "engine": "vLLM",
      "engineVersion": "0.8.5",
      "benchmarkVersion": "1.2.0",
      "promptTokens": 4096,
      "generatedTokens": 2048,
      "promptTPS": 1639,
      "generationTPS": 82.9,
      "ttft": 2625,
      "score": 62.2,
      "contributor": "tensoranne",
      "timestamp": "2026-07-25T22:43:08Z",
      "gitCommit": "762923f7540a0bc34c3360a63a5068ca09863957",
      "status": "VERIFIED"
    },
    {
      "id": "RUN-2026-07-26-000166",
      "model": "DeepSeek R1 Distill 32B",
      "family": "deepseek",
      "modelRevision": "60ca8f884642bf68777f56f5ca54886127235849",
      "quantization": "Q5_K_M",
      "hardware": "A100 80GB SXM",
      "gpuVendor": "NVIDIA",
      "vram": 80,
      "ram": 512,
      "cpu": "EPYC 7763",
      "engine": "exllamav2",
      "engineVersion": "0.3.4",
      "benchmarkVersion": "1.2.0",
      "promptTokens": 2048,
      "generatedTokens": 1024,
      "promptTPS": 727,
      "generationTPS": 61.6,
      "ttft": 2901,
      "score": 84.8,
      "contributor": "pagedout",
      "timestamp": "2026-07-26T21:26:38Z",
      "gitCommit": "b0b0b17b44c1681a934de0be059c6bcea77c17bf",
      "status": "VERIFIED"
    },
    {
      "id": "RUN-2026-07-28-000167",
      "model": "DeepSeek R1 Distill 32B",
      "family": "deepseek",
      "modelRevision": "5ac337726b6335c947e7a8cdec165ed5f8d4a0b4",
      "quantization": "FP8",
      "hardware": "M2 Ultra",
      "gpuVendor": "APPLE",
      "vram": 192,
      "ram": 192,
      "cpu": "M2 Ultra",
      "engine": "vLLM",
      "engineVersion": "0.8.5",
      "benchmarkVersion": "1.2.0",
      "promptTokens": 4096,
      "generatedTokens": 1024,
      "promptTPS": 382.3,
      "generationTPS": 15.3,
      "ttft": 10688,
      "score": 29.5,
      "contributor": "tensoranne",
      "timestamp": "2026-07-28T16:00:04Z",
      "gitCommit": "1d667738e8a29332cf2ceb449549ddd21eabb9d4",
      "status": "PENDING"
    },
    {
      "id": "RUN-2026-07-29-000168",
      "model": "Llama 3.1 8B",
      "family": "llama",
      "modelRevision": "dc8d224b6bd14faa55309e6cb572f81e3204f27a",
      "quantization": "FP16",
      "hardware": "L40S",
      "gpuVendor": "NVIDIA",
      "vram": 48,
      "ram": 256,
      "cpu": "Xeon Gold 6430",
      "engine": "vLLM",
      "engineVersion": "0.8.5",
      "benchmarkVersion": "1.2.0",
      "promptTokens": 8192,
      "generatedTokens": 2048,
      "promptTPS": 784.7,
      "generationTPS": 29.5,
      "ttft": 10729,
      "score": 14.7,
      "contributor": "pagedout",
      "timestamp": "2026-07-29T20:30:44Z",
      "gitCommit": "24fd6e2a1f0bf91c987d8d10256b94ff33b24510",
      "status": "VERIFIED"
    },
    {
      "id": "RUN-2026-07-31-000169",
      "model": "Llama 3.1 70B",
      "family": "llama",
      "modelRevision": "3725c1ecff40bc30663d04523a534c0fe39384ea",
      "quantization": "Q8_0",
      "hardware": "M2 Ultra",
      "gpuVendor": "APPLE",
      "vram": 192,
      "ram": 192,
      "cpu": "M2 Ultra",
      "engine": "llama.cpp",
      "engineVersion": "b5240",
      "benchmarkVersion": "1.2.0",
      "promptTokens": 2048,
      "generatedTokens": 1024,
      "promptTPS": 106.7,
      "generationTPS": 7.9,
      "ttft": 19513,
      "score": 25.2,
      "contributor": "vrampilot",
      "timestamp": "2026-07-31T13:38:02Z",
      "gitCommit": "16108819eb16391c664f75b460c054db68525864",
      "status": "REPRODUCED"
    },
    {